{
  "id": "ferroehr",
  "display_name": "FerroEHR",
  "compose_from": {
    "repository": "rubentalstra/FerroEHR",
    "path": "docker-compose.yml"
  },
  "ixit": "registry/topologies/ferroehr/ixit.json",
  "base_url": "http://127.0.0.1:8080/ferroehr/rest/openehr/v1",
  "ready_url": "http://127.0.0.1:8080/ferroehr/rest/openehr/v1/definition/template/adl1.4",
  "credentials": {
    "SUT_USER": "ferroehr",
    "SUT_PASS": "ferroehr"
  },
  "provenance": "The compose document is FerroEHR's own published quickstart, fetched from its repository at run time, so the reproduction drives whatever that release train currently pins. The Basic-auth pair is the quickstart's declared development user, which this repository's browser journeys drive first-hand. The topology declares one clinical principal and the unauthenticated one, so every case addressing an admin, read-only or SMART principal is recorded not-applicable at selection time rather than driven under the wrong identity."
}
